{
  "schema_version": "1.0.0",
  "session_id": "example-unmeasured",
  "device": "DocterWatch B20",
  "signal_source": "PPG",
  "metric_type": "PRV",
  "duration_s": null,
  "sampling_rate_hz": null,
  "analysis_window": null,
  "algorithm_version": "b20-prv-1.0.0",
  "software_versions": {},
  "quality_status": "UNMEASURED",
  "measurement_units": {
    "mean_ppi_ms": "ms",
    "sdnn_ms": "ms",
    "rmssd_ms": "ms",
    "sdsd_ms": "ms",
    "pnn50_pct": "%",
    "tp_ms2": "ms²",
    "vlf_ms2": "ms²",
    "lf_ms2": "ms²",
    "hf_ms2": "ms²",
    "lf_hf_ratio": "unitless",
    "lfnu_pct": "%",
    "hfnu_pct": "%"
  },
  "signal_quality": {},
  "data_provenance": {
    "source_kind": "unmeasured",
    "source_sha256": null,
    "is_device_validation": false
  },
  "calculated_at": null,
  "mean_ppi_ms": null,
  "sdnn_ms": null,
  "rmssd_ms": null,
  "sdsd_ms": null,
  "pnn50_pct": null,
  "tp_ms2": null,
  "vlf_ms2": null,
  "lf_ms2": null,
  "hf_ms2": null,
  "lf_hf_ratio": null,
  "lfnu_pct": null,
  "hfnu_pct": null
}
